{
  "id": "03a7d1c7-81e2-432f-9561-9df2691189c8",
  "filename_download": "directus-tshirt-product-interface.png",
  "title": "Directus E-Commerce T-Shirt Product Interface",
  "type": "image/png",
  "filesize": 659420,
  "width": 2560,
  "height": 1440,
  "description": "Screenshot of the Directus admin interface",
  "tags": ["e-commerce", "directus"],
  "uploaded_on": "2024-12-18T13:23:30Z"
}
